{
  "width": 4,
  "height": 3,
  "patches": [
    { "terrain": "home" }, { "terrain": "lot", "soil": 1 }, { "terrain": "paved" }, { "terrain": "creek", "water": 1 },
    { "terrain": "paved" }, { "terrain": "lot", "soil": 1 }, { "terrain": "home" }, { "terrain": "creek", "water": 1 },
    { "terrain": "home" }, { "terrain": "paved" }, { "terrain": "lot" }, { "terrain": "creek", "water": 1 }
  ],
  "agents": [
    { "id": "ana", "x": 0, "y": 0 },
    { "id": "bo", "x": 2, "y": 1 },
    { "id": "cy", "x": 0, "y": 2 }
  ]
}
